<xs:schema xmlns:xs="http://www.w3.org/2001/XMLSchema"
           targetNamespace="http://imobiliaria.org"
           xmlns="http://imobiliaria.org"
           elementFormDefault="qualified">

  <xs:element name="imobiliária">
    <xs:complexType>
      <xs:sequence>
        <xs:element name="imovel" maxOccurs="unbounded" minOccurs="1">
          <xs:complexType>
            <xs:sequence>
              <xs:element name="descricao" type="xs:string"/>
              <xs:element name="proprietario">
                <xs:complexType>
                  <xs:sequence>
                    <xs:element name="nome" type="xs:string"/>
                    <xs:element name="email" type="xs:string" minOccurs="0" maxOccurs="unbounded"/>
                    <xs:element name="telefone" type="xs:string" minOccurs="0" maxOccurs="unbounded"/>
                  </xs:sequence>
                </xs:complexType>
              </xs:element>
              <xs:element name="endereco">
                <xs:complexType>
                  <xs:sequence>
                    <xs:element name="rua" type="xs:string"/>
                    <xs:element name="bairro" type="xs:string"/>
                    <xs:element name="cidade" type="xs:string"/>
                    <xs:element name="numero" type="xs:integer" minOccurs="0"/>
                  </xs:sequence>
                </xs:complexType>
              </xs:element>
              <xs:element name="caracteristicas">
                <xs:complexType>
                  <xs:sequence>
                    <xs:element name="tamanho" type="xs:decimal"/>
                    <xs:element name="numQuartos" type="xs:integer"/>
                    <xs:element name="numBanheiros" type="xs:integer"/>
                  </xs:sequence>
                </xs:complexType>
              </xs:element>
              <xs:element name="valor" type="xs:decimal"/>
            </xs:sequence>
          </xs:complexType>
        </xs:element>
      </xs:sequence>
    </xs:complexType>
  </xs:element>

</xs:schema>